Date,Model,Capacity,Price,Link,Description
2024-06-03,iPhone Xr,256GB,"€ 90,00","Iphone xr 256gb zwart geen schade. Iphone was van mijn overleden opa, weet zijn inloggegevens niet meer voor icloud en unlock code",https://www.marktplaats.nl/v/telecommunicatie/mobiele-telefoons-apple-iphone/m2122519210-iphone-xr-256gb-zwart-icloud-lock
2024-06-03,iPhone Xr,64GB,"€ 60,00",Iphone xr 64gb scherm kapot,https://www.marktplaats.nl/v/telecommunicatie/mobiele-telefoons-apple-iphone/m2122557486-iphone-xr-64gb-scherm-kapot
2024-06-03,iPhone Xr,64GB,"€ 109,00",De iphone verkeerd in zeer nette staat en functioneert nog uitstekend. Voorzien van een gloednieuwe batterij. Compleet incl.: - Or,https://www.marktplaats.nl/v/telecommunicatie/mobiele-telefoons-apple-iphone/m2122376786-iphone-xr-64gb-black-in-zeer-nette-staat
2024-06-03,iPhone Xr,256GB,"€ 185,00","Deze iphone verkeert in uitstekende staat. Scherm en behuizing zijn krasvrij, telefoon heeft altijd in een hoesje gezeten. Alle ac",https://www.marktplaats.nl/v/telecommunicatie/mobiele-telefoons-apple-iphone/m2122552526-zeer-complete-iphone-xr-256-gb-zwart
2024-06-03,iPhone Xr,64GB,"€ 125,00","Betreft een zeer nette en perfect werkende iphone xr 64gb , toestel functioneert zoals het hoort ,,de accu percentage is 84% en de",https://www.marktplaats.nl/v/telecommunicatie/mobiele-telefoons-apple-iphone/m2122528200-iphone-xr-netjes
2024-06-03,iPhone Xr,64GB,"€ 140,00",Iphone xr 64gb scherm is kapot,https://www.marktplaats.nl/v/telecommunicatie/mobiele-telefoons-apple-iphone/m2122281924-iphone-xr-64-gb-met-doos-en-lader
2024-06-03,iPhone Xr,64GB,"€ 170,00",Iphone xr 64 gb,https://www.marktplaats.nl/v/telecommunicatie/mobiele-telefoons-apple-iphone/m2122344654-iphone-xr-64-gb
2024-06-03,iPhone Xr,64GB,"€ 150,00",Below dutch & polish text. ### English for sale: iphone xr 64gb red i'm selling my beloved iphone xr because i've upgr,https://www.marktplaats.nl/v/telecommunicatie/mobiele-telefoons-apple-iphone/m2122328364-for-sale-iphone-xr-64gb-red-verkoop-iphone-xr-rood
2024-06-03,iPhone Xr,,"€ 89,99",Ik verkoop dit omdat ik een nieuwe telefoon heb gekocht. Er zitten paar krasjes aan de bovenkant u krijgt het hoesje erbij. De bat,https://www.marktplaats.nl/v/telecommunicatie/mobiele-telefoons-apple-iphone/m2122439857-iphone-xr
2024-06-03,iPhone Xr,64GB,"€ 100,00",Enige defect= selfie camera werkt verder perfect. Geen barsten op t scherm. Kleine krasjes op de screen protector. 2 Jaar gebruikt,https://www.marktplaats.nl/v/telecommunicatie/mobiele-telefoons-apple-iphone/m2122568990-iphone-xr-64gb
2024-06-03,iPhone Xr,,"€ 110,00",Iphone xr met kapot scherm. 87% Batterij conditie,https://www.marktplaats.nl/v/telecommunicatie/mobiele-telefoons-apple-iphone/m2122419159-iphone-xr-met-kapot-scherm-87-batterij-conditie
2024-06-03,iPhone Xr,64GB,"€ 170,00",In verband met het krijgen van een nieuwe werktelefoon bied ik bij deze mijn rode iphone xr aan. Specificaties en bijzonderheden:,https://www.marktplaats.nl/v/telecommunicatie/mobiele-telefoons-apple-iphone/m2122328332-iphone-xr-red-64-gb
2024-06-03,iPhone Xr,,"€ 190,00",Iphone xr je ziet foto’s mag alles testen voordat je hem over neemt,https://www.marktplaats.nl/v/telecommunicatie/mobiele-telefoons-apple-iphone/m2122420179-iphone-xr-wit
2024-06-03,iPhone Xr,64GB,"€ 120,00","Tekoop, apple iphone xr 64gb. Kleur: zwart. Onlangs nieuw scherm en nieuwe accu laten plaatsen. Nu doet het toutchscreen vreemd, z",https://www.marktplaats.nl/v/telecommunicatie/mobiele-telefoons-apple-iphone/m2122568464-apple-iphone-xr-64gb-met-defect
2024-06-03,iPhone Xr,64GB,"€ 50,00","Iphone xr, 64gb, paar beschadigingen verder geen last van, achterkant is t grootste maar met een hoesje niet te zien hoesje krijgt",https://www.marktplaats.nl/v/telecommunicatie/mobiele-telefoons-apple-iphone/m2122328356-iphone-xr-64gb
2024-06-03,iPhone Xr,,"€ 200,00",Batteri conditie 85% kleine beschadiging in de screenprotector zoals te zien op de foto,https://www.marktplaats.nl/v/telecommunicatie/mobiele-telefoons-apple-iphone/m2122368518-iphone-xr
2024-06-03,iPhone Xr,,"€ 125,00","Ik verkoop dit omdat, ik een andere telefoon heb gekocht. De conditie is gebruikt. Er zijn hele (kleine) gebruikersporen, maar dan",https://www.marktplaats.nl/v/telecommunicatie/mobiele-telefoons-apple-iphone/m2122493336-iphone-xr-nette-staat
2024-06-03,iPhone Xr,128GB,"€ 179,99","Wilt u dit product direct in onze webshop bestellen en veilig met ideal afrekenen, klik dan op de link onderaan de advertentie!  ",https://www.marktplaats.nl/v/telecommunicatie/mobiele-telefoons-apple-iphone/m2122312515-apple-iphone-xr-128gb-coral-zo-goed-als-nieuw-compleet-i
2024-06-03,iPhone Xr,64GB,"€ 180,00",Zeer nette en snelle iphone xr 64gb. Er is altijd goed op de telefoon gepast en deze functioneert zoals een iphone hoort te functi,https://www.marktplaats.nl/v/telecommunicatie/mobiele-telefoons-apple-iphone/m2122406483-iphone-xr-nieuwstaat
2024-06-03,iPhone Xr,,"€ 50,00",Sommige appsworxen niet meer ondersteundmisschien iets oor kids,https://www.marktplaats.nl/v/telecommunicatie/mobiele-telefoons-apple-iphone/m2122216098-te-koopiphone-xr
2024-06-03,iPhone Xr,64GB,"€ 250,00","Drie apple telefoons, allemaal ongeveer 1 jaar in gebruik geweest. Doen het nog goed, maar ik heb zelf niks meer aan de verzamelin",https://www.marktplaats.nl/v/telecommunicatie/mobiele-telefoons-apple-iphone/m2122419572-apple-iphone-xr-64gb-8-plus-64gb-se-64gb
2024-06-03,iPhone Xr,128GB,"€ 290,00",Iphone xr 128gb zo goed als nieuw,https://www.marktplaats.nl/v/telecommunicatie/mobiele-telefoons-apple-iphone/m2122540959-iphone-xr-128gb-zo-goed-als-nieuw
